product_name,description,url,category,source
Data Privacy and Protection for SAP Software,"Your information systems hold high value business and personal data. The severity of protecting these data is further emphasized by current GDPR regulation. Are you really able to monitor who is accessing the sensitive personal and business data in your systems? Can you tell what is still the standard access within a usual usage of data and what can be seen as potentially suspicious / harming for your company? With Data Privacy and Protection solution we are able to exactly log and analyse all access to sensitive data within your entire organization, integrating information from multiple information systems in real-time. The Data Privacy and Protection solution can be deployed in on-premise mode or cloud base mode based on your preference. Data Privacy and Protection is Qualified by SAP and recommended for running with SAP R/3, SAP S/4, SAP BI, SuccessFactors, Hybris and Concur solutions. It also provides integration for data coming from Non-SAP systems.",https://www.mibcon.cz/en,SAP Store Software,bd
Dashpivot,"Dashpivot aggregates all of the data from your forms and activity, so that you can unlock custom analytics and insights with the click of a button or toggle of a filter.",https://sitemate.com/,Construction Software,bd
Cycle Count Scheduler,"Managing cycle counts is an onerous task for many, and for some, cycle counts may altogether be neglected due to the nuisance of organizing regular counts. Good news! Cycle counts got easier for those using Dynamics 365 Business Central with the Cycle Count Scheduler app from Insight Works. The Cycle Count Scheduler automatically enables users to generate cycle count schedules per location. Say goodbye to manually managing schedules and organizing specific item counts. The Cycle Count Scheduler app simplifies cycle counts, saves you time, and optimizes the process to help ensure your inventory data stay in check. Cycle counts are essential for several reasons, including knowing what is truly in stock so orders can be filled effectively, meeting compliance and audit requirements, and maintaining proper financial reporting. Features: * Define cycle count schedules by location, velocity/ABC code (Physical Inventory Count Code), Item Category, or any other criteria. * Define how many full counts per year with your preferred count frequency, and the system will calculate which items you need to count each cycle count to meet your objectives. * Automatically generate cycle counts for all locations by day, week, month, or other frequency based on your actual counting progress. * Define custom counting calendars to ensure cycle counts properly match your environment. * Schedule cycle counts to be produced automatically and e-mailed to users or sent to handhelds running WMS Express or Warehouse Insight.",https://www.dmsiworks.com/,Other Supply & Logistics Software,bd
Cybake,"Cybake gives you full visibility throughout your business to streamline processes, minimise waste and boost profits.",https://cybake.co.uk/,Bakery Software,bd
Cytracom,"Cytracom provides enterprise-grade Hosted VoIP and unified communications to businesses nationwide.Cytracom's VoIP solutions provide cost savings, mobility, scalability and reliability with a platform built on the most advanced cloud-based VoIP technology in the world, .",https://www.cytracom.com/,VoIP Providers,bd
Cydrill,CydrillSergeant’s award-winning e-learning platform equips your developers with the secure coding skills they need to beat hackers at their own game,https://cydrill.com/,Education Software,bd
CX.AI,"Don’t miss out on your HIDDEN CX LEVERS With World’s Best CX Analytics Solution • Unearth the unstructured “gold” you already have. • Fight spurious insights with Causal AI • No IT integration, no DIY tool, no data security review Watch this video to up your CX-Platform: www.cx-ai.com/vsl Trusted by Reputed Enterprises like ALLIANZ, AUDI, BASLER, BMW, SONOS, MICROSOFT, and counting",https://www.cx-ai.com/,Feedback Analytics Software,bd
DarwinAI,"Darwin answers questions accurately and slashing your team's conversation volume in a snap mainly through Whatsapp. We leverage AI to qualify leads (and much more), improving your sales team efficiency & saving time.",https://www.getdarwin.ai/es,Conversational Marketing Software,bd
Cuztomise,"Cuztomise is an FSM app it book a request, get notified instantly and track agen.",https://www.cuztomise.com/,Field Service Management Software,bd
Data Privacy Accelerator for GDPR and CCPA (London-Validated),"Growing privacy concerns and emerging data privacy regulations, such as EU GDPR and US CCPA, require companies to define and operationalize privacy policies, know the location and usage of all personal information and comply with specific regulatory requirements such as data subject rights, breach management and privacy impact analyses.",https://www.ey.com/,ServiceNow Marketplace Apps,bd
CYREBRO,"CYREBRO is a Managed Detection and Response solution, providing the core foundation and capabilities of a state-level Security Operations Center (SOC) delivered through its cloud-based, interactive SOC Platform. CYREBRO rapidly detects, analyzes, investigates and responds to cyber threats.",https://www.cyrebro.io/,System Security Software,bd
CyberVista,"CyberVista brings a unique and unbiased perspective to cyber risk training. Developed and delivered by a team of experts, we pride ourselves on being an education company first and foremost and are dedicated to empowering you with the necessary knowledge, tools, and connections to make sound cybersecurity-related business decisions.",https://www.cybervista.net/,Vulnerability Management Software,bd
Dairy One Crop Management Software,"This Internet-based software can help you organize all of your crop information in an easily accessible, centralized location. Internet or web-based means you can run the software from any location where there is a high-speed Internet connection, and it means you are always running the most current version.",https://dairyone.com/,Agriculture Software,bd
Cybrary,Cybrary is a free and crowd-sourced Cyber Security and IT learning platform.,https://www.cybrary.it/,Vulnerability Management Software,bd
D2L Brightspace,"D2L Brightspace is a flexible and powerful learning innovation platform built for every stage of life, from the earliest days of school to higher education and beyond.",https://www.d2l.com/,Education Software,bd
DaisyBill,DaisyBill builds revenue cycle management (RCM) software that solves workers’ comp billing,https://www.daisybill.com/,Financial Services Software,bd
Cyberark Endpoint Privilege Manager,"CyberArk Endpoint Privilege Manager enables organizations to enforce least privilege policies for business and administrative users, as well as control applications to reduce the attack surface without halting productivity. The solution helps organizations revoke everyday local administrator privileges from business users while elevating privileges when required by trusted applications. CyberArk Endpoint Privilege Manager also enables security teams to enforce granular least privilege policies for IT administrators, helping organizations effectively segregate duties on Windows servers. Complementing these privilege controls, the solution also delivers application controls, which are designed to manage and control which applications are permitted to run on endpoints and servers and prevent malicious applications from penetrating the environment.",https://www.cyberark.com/,Endpoint Protection Software,bd
CyberStrong,"The CyberStrong Platform is an integrated risk management solution powering automated, intelligent cybersecurity compliance and risk management. Built on the gold-standard foundation of the NIST Cybersecurity Framework, CyberStrong’s capabilities streamline GRC activities and provide a single pane of glass through which CISOs and their security teams can measure, report, and mitigate risk. CyberStrong's rapid time-to-value and patented Artificial Intelligence and Machine Learning automation eliminate manual effort and help organizations make informed decisions that reduce risk while driving overall business value.",https://www.cybersaint.io/,Security Compliance Software,bd
CXONCLOUD,CXONCLOUD is an ALL-IN-ONE APP built for small businesses to delight their customers at every single interaction in just simple clicks.,https://cxoncloud.com/,Enterprise Feedback Management Software,bd
Data Content Manager,"Improve Data Quality in ServiceNow Data Content Manager is a ServiceNow certified, Built on Now app, that enforces your data models and helps maintain and improve your data quality. It can increase the effectiveness and automation of your workflows while reducing unnecessary manual work and costly errors.",https://datacontentmanager.com/,ServiceNow Marketplace Apps,bd
CyberNewsWire,"CyberWire is a newswire syndication platform for cybersecurity companies. Using a hyper-targeted approach, companies use CyberWire to broadcast news on leading media outlets in the world of cybersecurity.",https://mediafuse.org/,Public Relations (PR) Software,bd
Cwallet,"Cwallet is a unique multi-functional wallet which offers centralized and decentralized functions together under one app! With its futuristic tech and user-friendly Cwallet tools, it offers a free & all-inclusive set of crypto tools for everyone, to empower a faster, easier and safer crypto journey thus bridging the gap between Web2.0 and Web3.0. It is not just a wallet to hold, buy or exchange your crypto assets but a comprehensive toolkit with multiple bot-enabled features like tipping and community management upon social networks to boost and support the future of crypto economy.",https://cwallet.com/,Blockchain Software,bd
DAT-MAIL,"DAT MAIL is the easiest post-presort product to implement, integrate with your current systems, and use with positive results - right out of the box",https://www.windowbook.com/,Other Email Software,bd
eMonitor,Your housing allocation software's for a better life in cities.,https://www.emonitor.ch/,Real Estate Software,bd
Daikessen,"With your account you can create all the websites you need and with the online store option included! Easy, fast and without technical knowledge. Your sites with a modern, professional and adaptable design to all devices. Unlimited hosting, unlimited transfer, online store included, free URL, free chat and much more. Create your account and create your website for FREE! You have FREE domain (url) Buy your own web domain through us and get your professional email for FREE!",https://www.daikessen.com/,Website Builder Software,bd
Data Collection on cloud native Local 5G,Intelligent cockpit on the cloud based on Local 5G,https://www.ailinking.com/,SAP Store Software,bd
Cynaptx,"Cynaptx is complete, modern, cloud-based, intuitive, and affordable Career Service Management solution. It is a network of universities, colleges, employers, students, and alumni driving the creation of opportunities by increasing engagement. Cynaptx empowers students to find the right job by providing an easy-to-use, intelligent and effective experience.",https://www.cynaptx.com/,Recruiting Software,bd
Darwin AI,"DarwinAI, an explainable AI company, enables enterprises to build AI they can trust. Founded by renowned academics at the University of Waterloo, DarwinAI’s Generative Synthesis technology makes explainability real, allowing developers to understand, interpret and quantify the inner workings of a deep neural network. Based on years of distinguished scholarship, the company’s patented explainability technology accelerates advanced deep learning design and unlocks new possibilities for the commercial uses of deep learning.",https://www.darwinai.com/,MLOps Platforms,bd
Data Deduplication & Record Linkage,This solution identifies data belonging to the same entity/duplicate records across two data sources and creates a linked master dataset.,https://stelligent.com/,Data Quality Tools,bd
Cyberlogic,Online Reservations - Distribution & Management of Travel Services that includes 2 applications: e-Tourism Operations & e-Tourism Suite,https://www.cyberlogic.gr/,Other Vertical Industry Software,bd
CustomViewbook,CustomViewbook is a digital viewbook platform that captures and converts highly qualified leads at a fraction of the costs of traditional methods.,https://customviewbook.com/,Education Software,bd
CyberVadis,"Mitigate third-party cyber risks. With confidence. CyberVadis is a trusted solution for mitigating third-party cyber risks. We combine the speed of automation with the reliability of a team of information security experts, providing evidence-based assessments. Our comprehensive, scalable and managed solution enables you to effectively reduce risks across your entire supply chain. - Manage all third parties on a single platform - Collect and monitor automated risk insights - Have all critical suppliers assessed by analysts based on evidence - Drive improvements & share recommendations",https://www.cybervadis.com/,Risk Assessment Software,bd
Cycle,"The Cycle Platform enables businesses to simplify container orchestration and infrastructure management. With a SaaS-managed operating system built specifically for containers, Cycle becomes the bridge between you and your infrastructure. Simplify the stack and gain the benefits of your own private cloud that spans multiple providers. No outrageous costs. Get started in minutes",https://cycle.io/,DevOps Software,bd
DaDaScribe,"DaDaScribe offers automated, high-quality audio/video-to-text transcriptions and translations in over 120 languages.",https://www.dadascribe.com/,Transcription Software,bd
Dalet Pyramid,"Dalet Pyramid reimagines modern storytelling, empowering users to craft and deliver meaningful stories together",https://www.dalet.com/,Newsroom Management Systems Software,bd
dailysender,Email marketing control panel which tracks campaigns and provides statistics and metrics.,https://www.dailysender.com/,Email Marketing Software,bd
Portfolio Manager,The reinsurance industry's leading cyber portfolio management solution with the broadest array of realistic and defensible scenarios classes and the transparency and controls required to allow reinsurers to develop their own view of the risk.,https://www.cybcube.com/,Financial Services Software,bd
Cybersecurity VR Training,"Effective cyber security training in VR Teach your employees that a hacker can take advantage of their inattention. Engaging Virtual Reality training will show them how a cybercriminal can fool them. What sets Company (Un)Hacked apart from other training courses? VR technology – Training is in the form of an application for virtual reality goggles Independence – the employee can train on their own Profesionalism – the program was developed in cooperation with SunCapital, which has been securing companies against cyber attacks for more than a dozen years, Entertainment and excitement – deep involvement of the employee makes him remember the training better Up-to-date – the program is kept up-to-date with the latest ways to attack Company (Un)Hacked is planned so that the employee learns more hacking techniques with each chapter. The most important goal of the training? To teach defense against attacks and understand the process of a cybercriminal.",https://www.giantlazer.com/,Vulnerability Management Software,bd
Cyberium,"Cyberium is a dual side low code app builder with blockchain for fast paced apps. We work for enterprises, governments, and businesses across many industry verticals. We provide a unified platform for both frontend and backend development using drag and drop design, build & deployment. It helps our customers to reach the market faster, respond rapidly to changes, and stay relevant to customer needs. With embedded blockchain, it helps customers to manage end-to-end business tokenization for embedded finance, plug & play fintech, business NFT management, post-border integration, multi organization collaboratives among many other leading solutions and services into transaction excellence.",https://www.cyberium.info/,Business Plan Software,bd
Dancer,Dancer is a simple but powerful web application framework for Perl.,https://www.freecad.org/,Web Frameworks,bd + ts
d-one,"d-one is a natively integrated supply chain management platform. It enables transparency and drives efficiency by connecting and optimizing end-to-end processes like planning (IBP and S&OP), execution and control of operations (MES, WMS, IIoT), and customers and suppliers collaboration (Sales Collaboration and Supplier Collaboration). d-one can be purchased by modules that solve your companies’ urgent challenges while planning your leapfrog towards the Future Factory. With its intuitive Made in Italy design and modern technology it enables fast adoption and a lean way of working, eliminating nonvalue add activities.",https://www.digitalsoft.com/,Sales & Ops Planning Software,bd
Darzin,Darzin is the most powerful stakeholder engagement tool in the world.,https://darzin.com/,Corporate Social Responsibility (CSR) Software,bd
Dappsuite,"DappSuite provides software for companies to build and manage Ethereum dapps. DappSuite enables you to create, import and export Ethereum accounts. The application provides interfaces that work seamlessly within the Salesforce Lightning Experience.",https://www.dapps-inc.com/,Salesforce AppExchange Apps,bd
Damnlist,Zero-cost customer database management system.,https://www.damnlist.com/,Other Marketing Software,bd
Darwin,At Darwin AI we believe you are one creative away from a breakthrough. Our proprietary Creative Analytics Platform is the leading Creative Optimization technology utilizing Artificial Intelligence. Darwin AI is used by global brands drive more performance from their omnichannel creative in terms of real measurable impacts on revenue and growth. Darwin AI also allows for customization to enable you to see the data that matters most to your business objectives.,https://darwinsoftware.io/,Creative Management Platforms,bd
CyLock,"Cybernexa, a global leader in information security, pioneers cutting-edge solutions such as CyLock MFA, SSO, ADPass, and PKI. Committed to innovation, our robust products address the dynamic security needs of today's mobile-centric environment. Offering seamless integration, CyLock MFA ensures multi-factor authentication, while CyLock SSO simplifies access to multiple systems. Manage Active Directory securely with CyLock ADPass, and fortify data integrity with CyLock PKI's encryption. Beyond products, our dedicated team delivers comprehensive cybersecurity compliance services, ensuring your organization stays ahead of threats. Choose Cybernexa for unparalleled security innovation, global reach, and comprehensive services tailored to diverse sectors.",https://www.cybernexa.com/,Identity Management Software,bd
Cytric Travel Suite 2.0 For SAP Solutions,"The cytric integration for SAP is the long-awaited missing link to meeting the challenges of modern Business Travel Management as it combines all scenatios of process and master data integration with the leading SAP system. By merging all systems involved, a holistic approach is made possible over the entire process cycle.",https://www.conovum.de/,SAP Store Software,bd
cvviz,"CVViZ is an AI recruiting technology that helps you improve your quality of hiring. Be it high volume hiring or niche hiring, the key is to reach right candidates sooner. CVViZ gives you that edge! Using AI for recruitment you can identify best candidates in the beginning of recruitment and selection process. CVViZ is a AI recruitment tool that provides intelligent automation of recruitment process. It can also integrate with existing Applicant Tracking System (ATS) to act as an intelligent layer on top of your existing system.",https://cvviz.com/,Recruiting Software,bd
CxPlanner,"CxPlanner is a construction and commissioning software. It allows businesses in the construction industry to enhance and optimize their construction and commissioning processes. The platform can be used for testing, inspections, creating 3D models, punch lists and more. This includes detailed test paradigms, quality assurance, gantt scheduling and more.",https://cxplanner.com/,Construction Software,bd
Cypherock X1 cold wallet,"Cypherock X1 is the world's safest hardware wallet. It is audited by Keylabs, a security firm that has found vulnerabilities in Ledger and Trezor. Cypherock X1 comes with a desktop application 'cySync' that let's you manage your crypto portfolio with ease and utmost security. - Store 3000+ tokens securely. - Open-source, certified reproducible by WalletScrutiny. - Use it as a seed phrase backup for your existing BIP39 wallets like Ledger, Trezor, Metamask. - View, manage multiple wallets' portfolios on a single app!",https://www.cypherock.com/,Blockchain Software,bd
Cythera,Managed Detection & Response,https://cythera.com.au/,System Security Software,bd
Cyber Platform,The ever-evolving Cyber Platform to help you manage your Cyber Compliance. Features include: V-Scanner – Cloud Hosted External Vulnerability Scanner Device Threats - CVE Vulnerability Reporting OWASP Scanner – (Alpha Release) – Hosted OWASP Scanning Windows Defender Central – Move to Windows Defender without ATP licenses Bitlocker Disk Reporting – Report Non-Encrypted Disk Risk Azure AD Device Reconciliation – Reconcile Devices with Azure Active Directory (primary user store) Software Central – Central Reporting on Software Versioning Hardware Central – Central Reporting on Hardware Estate,https://www.roboshadow.com/,Endpoint Protection Software,bd
CybderDefense Program,CalTech's CyberDefense Program is a carefully researched and curated suite of systems and services designed to improve the IT security standing of your organization.,https://www.caltech.com/,System Security Software,bd
dalos,"Dalos is a Revenue Growth Platform. It enables Technology Companies to grow their maintenance and subscription renewal revenue and enhance their end-user experience. Dalos is an interactive, data-driven platform built to fully manage and automate the renewal lifecycle. It has a secure Web Portal allowing end-users to interact with renewal subscriptions, view contracts, and track assets and licenses, sales orders, and invoices. To learn more about how Dalos can maximize your renewal revenue and retain customer success, visit our Dalos website.",https://dalos.co/,E-Commerce Software,bd
Darkbeam Cyber Stars Initative,The Cyber Stars Initiative. Discover the only nationally recognised qualification in cyber threat awareness.,https://www.darkbeam.com/,Vulnerability Management Software,bd
CybelAngel,CybelAngel is a SaaS security platform that ensures optimal data protection by monitoring devices on the network and identifying security leaks.,https://cybelangel.com/,System Security Software,bd
CVM Zimbra Hosting,CVM Zimbra Hosting offers mail server hosting,https://cvm.com/,Other Hosting Services Providers,bd
D-EDGE,"WEBSITE DEVELOPMENT Showcase and sell your hotel on the web Travellers want to be amazed, they look for the unexpected, but with all the information just a click away. Give them what they want! Our hospitality-dedicated Web Studio will showcase your hotel on the web according to the brand image and experience you want to offer to your guests. Your website is your hotel’s front door... DRIVE MORE DIRECT BOOKINGS",https://d-edge.com/,Hospitality Software,bd
D365 Data Quality,D365 Data Quality solution extends the natural capability of your Dynamics 365 CRM by providing visibility into your data quality and the controls to improve it. The web application solution ensures data issues are captured as the data is being entered allowing immediate correction. Data stewards are provided with the tools they need to provide a trusted source of customer data for your entire organization.,https://www.adastracorp.com/,Data Quality Tools,bd
Cybertiks,Cybertiks enhances agricultural and environmental monitoring through advanced AI analytics.,https://www.cybertiks.com/,Agriculture Software,bd
D-Sight Collaborative Decision-Making Tool (CDM),D-Sightâ€™s Collaborative Decision-Making platform offers a structured approach that supports these complex decisions.,https://www.d-sight.com/,Decision-Making Software,bd
Data Platform,Flexera's data intelligence library is the world’s largest and most comprehensive repository of market intelligence on enterprise software and hardware.,https://www.flexera.com/,IT Asset Management Software,bd
CyberDefenders,"CyberDefenders is a Cyber Security Blue Team training platform designed for SOC analysts, threat hunters, incident responders, and digital forensics professionals. It focuses on the defensive side of cyber security, providing an environment to learn, validate, and advance cyber defense skills through hands-on labs. The platform offers Certified CyberDefender (CCD) training and certification alongside dynamic and subscription-based lab experiences via the BlueYard CyberRange, catering to continuous learning against emerging security threats.",https://cyberdefenders.org/,Vulnerability Management Software,bd
Data privacy analysis service for SAP ILM,Facilitate your Information Lifecycle Management implementation for data compliance,https://www.sap.com/,SAP Store Software,bd
Cypress,Cypress offers a test engine that runs unit and integration tests in a browser.,https://www.cypress.io/,Software Testing Tools,bd
CustomerSure,"Software so you can gather, manage and respond to customer feedback, improve customer satisfaction and increase sales.",https://www.customersure.com/,Experience Management Software,bd
