product_name,description,url,category,source
Exberry,"The world of exchanges and marketplaces is growing exponentially and changing drastically. But the infrastructure supporting these markets is outdated and does not provide an appropriate solution to the quick changing requirements. Exberry delivers a deep-tech trading infrastructure solution that offers turnkey solutions for exchanges, banks, digital securities and digital assets marketplaces. Exberry allows close to zero time to market and flexible cost structures that are not possible in existing leading solutions. Exberry is lowering the entry point to establish an efficient market and presents a totally new reality for new and traditional players in the industry.",https://exberry.io/,Financial Services Software,bd
ExactScience,"ExactScience is rank tracking software for SEOs. Use marketing segments like need states, personas, and topic clusters to track the rankings and pixel height of your website on Google. Monitor performance across multiple domains and competitors at no additional price. Granular control by device, location, and frequency for the most precise rank tracking.",https://www.exactscience.io/,SEO Tools,bd
Findings,Findings is a note taking app designed for scientists.,https://findingsapp.com/,Laboratory Software,bd
findsportclub.com/register,"First of all it is a B2B and B2C service. In detail it is a sport management service including website, management of staff, parents, children, adult athletes, communication etc. Also it is a search page for finding sport clubs, by individuals who would like to get registered as members in sport clubs. There is a frontend and backend demo at findsportclub/register, where B2B functionality is obvious",https://findsportclub.com/,Sports Software,bd
Finexio,Finexio simplifies Accounts Payable payments by eliminating all friction in payment delivery and supplier payment acceptance. Finexios comprehensive AP Payments as a Service solution leverages proprietary analytics and process automation to drive maximum conversions of suppliers to e-payments. Finexio delivers and supports a variety of payment methods to generate revenue and cost savings for middle-market companies while offering complete transparency and control of the payment process.,https://finexio.com/,Accounting & Finance Software,bd
ExaminePRO,EXAMINE PRO software allows dentists to bring together and store a patient's digital images in one place,https://www.henryschein.com/,Health Care Software,bd
EvA WinOptimize - Fenestration Software,EvA WinOptimize is a unique light-weighed online application which can be used by any dealers or executive who don’t have any prior product knowledge to instantly generate quotation on the site. It has desktop as well as cloud version.,https://evawinoptimize.com/,Other Vertical Industry Software,bd
Evoke,"Evoke from BlueFinity, is a rapid App development platform designed to provide for the fast development and deployment of mobile, desktop and web apps. Evoke allows you to build business apps, and extend enterprise applications, for your customers, employees and partners in a fraction of the time and cost of regular methods.",https://www.bluefinity.com/,Application Development Software,bd
Exela Revenue Integrity,Exela’s revenue integrity program consists of elements that help optimize revenue integrity programs. Our mission is to help identify and recover all dollars rightfully and contractually due to providers from all third-party payers.,https://www.exelatech.com/,Health Care Software,bd
EvaWarm,"It is important to land your emails in recipients’ inboxes by having a good domain reputation. EvaWarm offers user engagements for your email account at scale to increase your sender reputation, so you never land in SPAM.",https://evawarm.com/,Email Deliverability Tools,bd
EZnet Scheduler,"Eznet Scheduler Is An Online Appointment Scheduling Program That Makes Scheduling Fast, Easy, And Affordable.",https://www.eznetscheduler.com/,Online Appointment Scheduling Software,bd
Ezypay,Ezypay is a recurring customer payment collection platform that instantly enables fast growing businesses to accept and manage recurring payments.,https://www.ezypay.com/,E-Commerce Software,bd
Executive Briefing Service,The Executive Briefing Service for ConnectWise provides a Business Operations Control Panel for MSP CEO's.,https://newhaventech.com/,Other Analytics Software,bd
Expandable ERP,Integrated Enterprise Tools for Profitable Business Management,https://www.expandable.com/,Discrete ERP Software,bd
Facilities Online,Frontline Data has emerged as a leading new generation provider of online property and facilities management software.,https://www.frontlinedata.co.uk/,Asset Management Software,bd
Evia Warranty Management System,"Evia's Warranty Management System offers end-to-end solutions to its clients. Its comprehensive application helps customers increase their productivity. What's more, collectively, Evia's warranty management software called as 'WMS', helps increase overall product quality by tracking typical claims and in turn, their operational costs. This further increases customer satisfaction. Here is a detailed picture of how Evia's Warranty Management System for mobile suppliers helps increase dealers' productivity and business.",https://www.eviaglobal.com/,Warranty Management Software,bd
FaircomEDGE,c-treeAMS: Replication Agent is a real-time database synchronization solution gives a synchronizing a physically and logically separate copy of a database.,https://www.faircom.com/,Industrial IoT Software,bd
Everledger,"Everledger is a global emerging technology enterprise which creates and maintains ecosystems of trust to address real-world challenges. By incorporating a rich forensic approach to identifying and tracking assets, we deliver the transparency and confidence needed to bring disparate stakeholders together.",https://everledger.io/,Apparel Software,bd
Explore services for Intelligent ERP,"Running on intelligent digital technologies is a top priority today. With a pragmatic approach, this service identifies value-adding use cases of intelligent technologies in SAP S/4HANA to optimize your business processes and transform your business into an intelligent enterprise that is future-ready.",https://www.sap.com/,SAP Store Software,bd
Exwog,Free generator of Word files by template (Word file) on the basis of the Excel data file. Store your data in Excel format (.xls and .xlsx) and generate Word format files (.doc and .docx) in a few clicks.,https://exwog.com/,File Converter Software,bd
FactWise,"FactWise is a funded, early-stage technology startup building solutions for global small and mid-sized product manufacturing companies. Our singular focus is to create a truly distinctive procurement platform that delights users and provides sustainable positive impact to the organizations we serve. We achieve this by providing transparency and insights to leaders, streamlining and automating processes to improve efficiency, and driving bottom-line impact by unlocking savings potential. FactWise S2P is modular, and accounts for batch production, goods receival workflows and quality checks. Our current users find it very intuitive and efficient (create Rfxs <1min) and love the dynamic and historic insights into supplier performance it offers. Teams can start using FactWise with their data immediately, and if required, we can seamlessly integrate with ERP or other systems within the month. We are committed to generating win-win outcomes for buyers and suppliers globally.",https://www.factwise.io/,Procurement Software,bd
EventHub,EventHub connects your event attendees to the information they need to get the most benefit from your event. EventHub leverages the power of mobile devices and HTML5 to deliver relevant Attendee based tools.,https://www.validar.com/,Event Management Software,bd
expoze.io,Our AI powered eye-tracking solution expoze.io allows you to create your best creative. Our platform analyses images and video with very high accuracy in a matter of minutes and generates a heatmap so you can identify what elements within your creative get noticed.,https://www.expoze.io/,Conversion Rate Optimization Tools,bd
Eyewitness,"See what happens on the payment page : Eyewitness drastically reduces the cost of complaint management and nurtures trustworthy relationships between MNOs, merchants, and payment aggregators by recording and certifying the user journey.",https://www.evina.com/,Other Marketing Software,bd
EVComplete,"Cloudficient EVComplete enables organizations with Enterprise Vault to orchestrate onboarding large user populations to Office 365, bringing over on-premise mailboxes and their associated archives with ease.",https://www.cloudficient.com/,Data Integration Tools,bd
Extreme Compute,"EC cloud infrastructure is designed to deliver super-efficient Enterprise-ready cloud with key functionalities like Banking grade security, Hi-speed storage, Multi-cloud governance, Disaster Recovery, and APM without the need to procure & integrate each element separately.",https://www.extremecompute.com/,Infrastructure as a Service (IaaS) Providers,bd
eXert CRM,eXert CRM software is designed on the basis of the current lifestyle and trending of the target audience and demographics.,https://exerterp.com/,CRM Software,bd
EuropeanMX,"EuropeanMX protects your company by blocking 99,98% of all spam and virus emails before they reach your company network. This also works outbound to protect your reputation and clients.",https://europeanmx.eu/,Email Security Software,bd
Exam.net,"Exam.net is a powerful online exam platform for digital assessments and secure exam proctoring. It provides the teachers at schools and universities with an intuitive and efficient way to plan and conduct the exams tailored to each individual student's needs. The teachers can create new exams directly in the platform which can be corrected automatically, or upload the existing ones as PDF files. Students don’t need to create an account to conduct exams and the results can be easily shared through downloads, print outs or export to Google Drive, OneDrive and other platforms. Exam.net is also integrated with Google Classroom. Exam.net has a rich set of built-in tools across math, science and language. We also offer multiple levels of security to meet the needs of different exam types. It is the most used platform for digital examinations in Swedish schools and is used for the country’s National Examinations.",https://exam.net/,Education Software,bd
Ex-human AI Image Generation,Effortless Product Personalization Generate unique visuals for each customer segment in seconds. Reduce Content Creation Costs Produce high-quality images without expensive photoshoots. Boost Marketing Agility Respond to market trends with lightning-fast image variations.,https://exh.ai/#image-generation,Generative AI Software,bd
Eventicious,"We develop Custom-made, Handy and Beautiful Mobile Apps for professional Events.",https://www.eventicious.com/,Event Management Software,bd
Extended Supplier Portal,"Central portal for all of your supplier related apps, workflows and information This extension acts as a single place for all supplier-related applications and information. While the core Buyer-supplier standard transactions will happen via SAP Ariba or similar solutions, this extension provides additional support for non-standard, Buyer-supplier custom collaboration.",https://rrssi.com/,SAP Store Software,bd
EXEMPTAX,EXEMPTAX provides a full-service platform to manage your tax exemption certificates throughout every stage. EXEMPTAX helps you to manage your tax certificate obligations correctly and respond to audits quickly.,https://www.exemptax.com/,Accounting & Finance Software,bd
EventAct,"EventAct is a cloud-based management solution for your events that provides registration, tickets, accommodations, memberships and more to help you manage your events and conferences.",https://www.eventact.com/,Event Management Software,bd
Expensify,"Expensify is a payments superapp that helps individuals and businesses around the world simplify the way they manage money. More than 12 million people use Expensify's free features, which include corporate cards, expense tracking, next-day reimbursement, invoicing, bill pay, payroll, and travel booking in one app. All free. Whether you own a small business, manage a team, or close the books for your clients, Expensify makes it easy so you have more time to focus on what really matters.",https://www.expensify.com/,Accounting & Finance Software,bd + ts
Evensi,"Advertise your events on Facebook, Instagram, Messenger and Evensi, the world's largest event-based network.",https://business.evensi.com/,Event Management Software,bd
Experts Exchange,"Experts Exchange is the tech professional’s trusted, on-demand resource for solving difficult problems, making informed decisions, and delivering excellent solutions.",https://www.experts-exchange.com/,Technology Research Services,bd
Event Registry,"Event Registry is a system for real-time collection, annotation and analysis of content published by global news outlets.",https://eventregistry.org/,Content Marketing Software,bd
FincenFetch,"Corporate Transparency Act Filing Software for Law & Accounting Firms. FincenFetch helps your firm securely collect information, easily work with clients, and file reports for any number of small businesses that depend on you.",https://www.fincenfetch.com/,Accounting & Finance Software,bd
ExacTrac Dynamic,Position Control for a Broad Range of Clinical Workflows,https://www.brainlab.com/,Health Care Software,bd
evisio,"evisio gives SEO teams a central hub for auditing, analyzing, organizing, and executing tasks so that more gets done in less time without anything falling through the cracks. As a client management platform, it crawls your client’s website, uses found crawl issues to automatically create tasks, and brings your team together to tackle projects. Simply log in to your evisio dashboard, select an SEO project, and pick up on a task where you left off.",https://evisio.co/,SEO Tools,bd
Evinced Dev Debugger,"Weave accessibility into all facets of software development - Design, development, automated testing, QA testing, and production monitoring.",https://www.evinced.com/,Web Accessibility Software,bd
Exhibition Expert,"Forget the sticky notes, endless meetings and emails with yet another spreadsheet attached. Exhibition Expert is the straightforward website which makes organising your next exhibition a breeze!",https://exhibitionexpert.com/,Event Management Software,bd
Factory AI,"Factory helps organizations automate and optimize their software development lifecycle with autonomous, AI-powered systems called Droids.",https://www.factory.ai/,Other Development Software,bd
ExpenseWire,"Take control of your organization's expenses, ensure compliance with company policy, and accelerate reimbursements with ExpenseWire expense management system.",https://www.paychex.com/,Accounting & Finance Software,bd
EVRYTHNG,Make your products smarter with EVRYTHNG’s IoT Smart Products Platform,https://evrythng.com/,IoT Analytics Platforms,bd
ExpressConnect,"ExpressConnect® is an all-in-one platform where you can manage your data center maintenance. Simplify your service with automated alerts, account insights, ticketing integration and more.",https://serviceexpress.com/,Monitoring Software,bd
Expense Check,"EXPENSE CHECK We believe time is everything and have a mission to use data to make complex decisions simple. We have created a platform that is doing the impossible; making insurance transparent, accessible and lovable.",https://www.expensecheck.com.au/,Financial Services Software,bd
Exceedra,"The Exceedra system supports a closed-loop integrated business planning process and revenue management solutions, giving you tighter control, better and faster decision-making, and more detailed visibility across your entire enterprise.",https://www.telus.com/,Consumer Goods Software,bd
Everyware,"Everyware offers payment solutions for any organizations in a wide variety of industries, helping companies collect payments and connect with customers, especially through text messaging, the ultimate contactless technology. The company helps clients to boost revenue, reduce chargebacks and refunds, as well as improve customer service.",https://everyware.com/,Accounting & Finance Software,bd
EZGovOpps Market Intelligence,"EZGovOpps is a federal government procurement tool specifically designed for government contractors, capture managers, business developers, proposal writers, and government researchers.",https://www.ezgovopps.com/,Public Sector Software,bd
FinClock Project Management System,"You shall create projects, assign budgets, timelines and delegate to project managers. Plan projects into milestones, which can be tracked in real-time, both on phone and web. Project Managers will update progress of a given project, both with or without internet. Respond to challenges in your project, before they affect the performance. You will be able to approve payments for a project right on time. Your business will save time and money using best Task Management System",https://finclock.com/,"Project, Portfolio & Program Management Software",bd
Exchange rate,Automatically import exchange rates from certain sources (e.g. European Central Bank) into your SAP Business ByDesign system. Stop wasting time with manual data transfers and keep the exchange rates current at all times and prevent transmission errors,https://www.snap-int.com/,SAP Store Software,bd
Facility Security Management,"A varied and intensive set of tasks are involved in managing physical security. Well-supporting software is crucial in order to plan and deal systematically with the increasing flow of different operations, resources and disruptions.",https://www.fruitionpartners.nl/,ServiceNow Marketplace Apps,bd
Event Portal for Apache Kafka,"With use of Kafka having grown exponentially, event streams are a treasure trove of high value, real-time data that is often unknown or overlooked. Solace Event Portal helps organizations realise better value off their Kafka infrastructure along with enabling developers to easily design streaming applications, and provision those applications Kafka configurations in a modern, self-service way. Imagine API management but for events. Just like how API management enables the exposure, lifecycle management and governance of RESTful/GraphQL APIs but in this Kafka for your Kafka streaming platform.",https://solace.com/,AWS Marketplace Software,bd
Expansify.ai,"Are you tired of the constant struggle to manage your social media, email marketing, and content creation? Expansify.ai is here to save the day! Expansify.ai is the ultimate AI-powered marketing platform designed to revolutionize your digital marketing efforts. Imagine having a dedicated marketing team at your fingertips, saving you over 10 hours a week and significantly boosting your ROI. Our platform is an all-in-one solution that leverages cutting-edge AI technology to streamline and enhance your marketing activities. From automating your social media posts to crafting personalized email campaigns and generating SEO-optimized content, Expansify.ai does it all.",https://expansify.ai/,Social Media Marketing Software,bd
Voip,"EveryDay Voip integrates phone, video, meetings and messaging in one easy to use reliable PBX solution. Our service has been designed to keep you connected with your clients, anywhere around the world, giving you the flexibility to operate your business, as you wish. Install our apps on your desktop, smartphone or tablet and experience HD-quality web, audio, and video, along with one-click functionality. Promote collaboration with team messaging, unlimited SMS, and more.",https://www.everydayvoip.uk/,VoIP Providers,bd
Evolution EHR and Practice Management,Evolution EHR and Practice Management are design specifically with your practice in mind.,https://www.medworxs.com/,Health Care Software,bd
eventa Protocol,"Eventa is a premier events, protocol and ceremonials management suite. Consisting of a powerful, integrated set of web-based solutions, the system provides a comprehensive product that automates the ins and outs of the most complex events and protocols, thus facilitating and accelerating work completion, while ensuring a high level of security across the entity's different branches and departments. The system is replete with multi-functional features that maximize performance while minimizing margins of error.",https://esensesoftware.com/,Event Management Software,bd
Excelsior JET,"Excelsior JET is a toolkit and complete runtime environment for optimizing, deploying and running applications written in the Java(tm)programming language. The product package includes Excelsior JET Optimizer, Excelsior JET Runtime and Excelsior JET Installation Toolkit.",https://www.excelsiorjet.com/,Other Development Software,bd
EZCount,"#1 cloud accounting software in Israel for self-employed professionals and their teams.The system enables businesses of any size to issue digital documents, credit cards clearing (even without an account with credit card company), and to set up payment pages to be able selling products on the Internet automatically.",https://www.ezcount.co.il/,Accounting & Finance Software,bd
ExpandIT Mobile Field Service,Send the right people to the right job with the right tools and materials,https://expandit.com/,Field Service Management Software,bd
Evernym,Work with experts and peers to deliver real customer solutions that drive growth and reduce cost and risk.,https://www.evernym.com/,Identity Management Software,bd
ezPaycheck,"ezPaycheck is an easy-to-use payroll software designed with small businesses in mind: simple, reliable and affordable",https://halfpricesoft.com/,Payroll Software,bd
ExplaraBiz,"ExplaraBiz is an all-in-one Business & Commerce Software for you to start an online business, market & sell your digital products, physical products and services to your audience anywhere in the world, collect payment and manage your business.",https://www.explara.com/,Event Management Software,bd
EWIZ Power PS,EWIZ Power PS is a catalog management solution geared towards apparel companies that allows you to create catalogs within minutes.,https://www.powerweave.com/,E-Commerce Software,bd
EvidenceOnQ,"EvidenceOnQ™—the property and evidence tracking software from FileOnQ, Inc.™—gives local and state agencies and property rooms the power to manage, maintain, and track property and evidence like never before since our solution is 100% user-configurable.",https://www.fileonq.com/,Public Safety Software,bd
Eventuosity,"Easily manage your event on-the-fly with the eventuosity Mobile Application! Available on both iOS and Android, the eventuosity app gives you complete control over your event even on the go.",https://eventuosity.com/,Event Management Software,bd
Facttwin,"What is Facttwin? Facttwin revolutionizes the manufacturing sector with its state-of-the-art Industrial IoT platform. By enabling real-time monitoring, predictive maintenance, and comprehensive production management, it empowers businesses to leverage data analytics for improved decision-making and increased productivity. Perfectly aligned with Industry 4.0, Facttwin is essential for manufacturers seeking to optimize operations and drive digital transformation.",https://www.akriviahcm.com/,Industrial IoT Software,bd
Everlance,"Everlance provides modern vehicle program and reimbursement solutions. With the #1-rated mileage and expense tracking app, an easy-to-use management dashboard and top-tier customer service, it saves customers time and money.",https://everlance.com/,Accounting & Finance Software,bd
EventAgent.ai,"EventAgent.ai combines a next-generation online event platform with AI-assisted marketing to fill your retreats, seminars, courses and drop-in events. It provides industry-leading Zoom integration, an event calendar with registration, a deep toolset for event managers and AI-driven strategic marketing through social media channels. Free to use.",https://eventagent.ai/,Event Management Software,bd
eWork,"eWork is a multilingual Virtual Clocking & Task Tracking App for off-site employees to record working hours spent in different workplaces.With eWork, companies will have access to the geolocation of their mobile workforce with 6 anti-fraud proprietary controls embedded to notify the company about GPS alterations, sensors disconnection or other fraud techniques.",https://ecosagile.com/,Time Tracking Software,bd + ts
Excede,"Excede is a dealer management software that allows you access to your business data via Microsoft technology with real-time transactions, data viewing onscreen, the ability to export into a variety of formats, and run reports.",https://www.procedesoftware.com/,Automotive Software,bd
Evox,Next generation Human Resources solutions,https://evox.work/,Other HR Software,bd
EZ Collector,"EZ COLLECTOR offers all the features, flexibility, and sophistication of mainframe packages at an affordable price",https://debtcollectionsoftware.com/,Accounting & Finance Software,bd
