product_name,description,url,category,source
Webpack,"A bundler for javascript and friends. Packs many modules into a few bundled assets. Code Splitting allows to load parts for the application on demand. Through ""loaders"" modules can be CommonJs, AMD, ES6 modules, CSS, Images, JSON, Coffeescript, LESS, ... and your custom stuff.",http://webpack.github.io/,JS Build Tools And Task Runners,ts
WebRTC,"It is a free, open project that enables web browsers with Real-Time Communications (RTC) capabilities via simple JavaScript APIs. The WebRTC components have been optimized to best serve this purpose.",http://www.webrtc.org,Audio Conferencing,ts
Weekdone,"It is an internal communication service for teams which enables the OKR goal-setting and Progress, plans, problems weekly reporting methodologies.",https://weekdone.com,Knowledge Management,ts
Windows,A series of personal computer operating systems produced by Microsoft as part of its Windows NT family of operating systems. ,http://www.microsoft.com/,Server And Desktop OS,ts
Wistia,"It is designed exclusively to serve companies using video on their websites for marketing, support, and sales.",http://wistia.com/,Analytics,ts
Wix,"Creating your stunning website for free is easier
than ever. No tech skills needed. Just pick a template,
change anything you want, add your images, videos,
text and more to get online instantly.",http://www.wix.com,Site Builder,ts
Woodpecker,It is a document automation platform and suite that empowers users to cut document prep time in half by automatically converting existing documents to standardized smart-templates.,https://www.woodpeckerweb.com/,Document Collaboration,ts
Wootric,"It is a simple and powerful way to listen to your customers inside your product.  We measure Net Promoter Score (NPS), a recognized and rigorous customer happiness metric, to keep an ongoing pulse on how your customers feel about your product. Get contextual product feedback and analytics to help you improve your product and drive agile development.",http://www.wootric.com,Survey,ts
WordPress,"The core software is built by hundreds of community volunteers, and when you’re ready for more there are thousands of plugins and themes available to transform your site into almost anything you can imagine. Over 60 million people have chosen WordPress to power the place on the web they call “home” — we’d love you to join the family.",http://wordpress.org,Blogging Platform,ts
Workast,"Workast is a project and task management tool for teams on Slack. You can create tasks, manage projects and track daily work with Workast. Workast integrates seamlessly with Slack so you can create tasks without leaving your conversations. ",https://workast.io,Project Management,ts
Workday,"Workday is a leading provider of enterprise cloud applications for finance, HR, and planning that delivers financial management, human capital management, and analytics applications designed for the worlds largest companies, educational institutions, and government agencies.
",https://www.workday.com/,HRMS,ts
Wrike,Cloud-based collaboration and project management software that scales across teams in any business.,http://www.wrike.com,Project Management,ts
Wufoo,"Wufoo automatically builds the database, backend and scripts needed to make collecting and understanding your data easy, fast and fun. Because we host everything, all you need is a browser, an Internet connection and a few minutes to build a form and start using it right away.",http://wufoo.com,Forms And Surveys,ts
Xcode,"The Xcode IDE is at the center of the Apple development experience. Tightly integrated with the Cocoa and Cocoa Touch frameworks, Xcode is an incredibly productive environment for building amazing apps for Mac, iPhone, and iPad.",https://developer.apple.com/xcode/,Cloud IDE,ts
Xero,"Inventory, invoicing, time tracking, expenses, and hundreds of other apps all seamlessly integrate with Xero to save your business precious time and money.",https://www.xero.com,Accounting,ts
XMPP,"It is a set of open technologies for instant messaging, presence, multi-party chat, voice and video calls, collaboration, lightweight middleware, content syndication, and generalized routing of XML data.",http://xmpp.org,"Queueing, Messaging And Background Processing",ts
YOOBIC,YOOBIC Boost is a fun and interactive way to train and engage your teams. It helps frontline teams and deskless workers to learn faster through bite-sized and engaging content for continuous learning and improvement.,,Learning Management Systems,ts
Zammad,"It is a web based open source helpdesk/customer support system with many features to manage customer communication via several channels like telephone, facebook, twitter, chat and e-mails.",https://zammad.org/,Helpdesk Tools,ts
Zapier,"Zapier is for busy people who know their time is better spent selling, marketing, or coding. Instead of wasting valuable time coming up with complicated systems - you can use Zapier to automate the web services you and your team are already using on a daily basis.",https://zapier.com/,Test Automation,ts
Zeplin,Collaboration app for designers & developers. Supports Sketch and Photoshop (on beta!).,http://bohemiancoding.com/sketch/,Graphic Design Software,ts
Zoho,"Unique and powerful suite of software to run your entire business. It contains word processing, spreadsheets, presentations, databases, note-taking, wikis, web conferencing, customer relationship management, project management, invoicing, and other applications.",https://www.zoho.com,Productivity,ts
Zoho Creator,"It is a low-code application development platform that enables users to build powerful and custom applications for their business needs. ‌A user with any level of technical expertise can create functional applications owing to the platform's intuitive interface and short learning curve. Be it a simple task manager or a complex ERP system, you can build any type of tailor-made solutions 10X faster than traditional methods.

Users can create custom forms, configure workflows, build informative pages, and get their app up and running in minutes. With over 6 million users worldwide and 60+ apps, our platform enhances business productivity.",https://www.zoho.com/creator/,Cross Platform App Dev Tools,ts
Zoho Desk,It puts customer service at the heart of your company. It is the industry's first context-aware help desk software that helps businesses focus on the customer.,https://www.zoho.com/desk/,Helpdesk Tools,ts
Ember.js,"A JavaScript framework that does all of the heavy lifting that you'd normally have to do by hand. There are tasks that are common to every web app; It does those things for you, so you can focus on building killer features and UI.",http://emberjs.com/,JavaScript MVC Framework,ts
SAP,It is an ERP (Enterprise Resource Planning) software used for effective business operations. It is used for below operations: Supply Chain Management. Product lifecycle management.,https://www.sap.com/index.html,Resource Scheduling,ts
Zoho Mail,"It is a secure and reliable business email solution tailor-made for your organization's communication needs. With enhanced collaboration features, it's not just an inbox—it's more.",https://www.zoho.com/mail/,Email Marketing Platforms,ts
Zoho Projects,"It is an online project management software to create and manage projects efficiently. You can plan your project activities, assign work, manage resources and collaborate with your team better to get things done on time.",http://www.zoho.com/crm/,Project Management,ts
Zoho Recruit,"Zoho Recruit is an applicant tracking system catering to multiple hurdles faced by recruiters. With complete solutions for both in-house recruiters and staffing agencies, Zoho Recruit helps you source, track, and hire the best candidates, without any juggling required across different media.

Customize every aspect of your workday and automate tasks like sending emails, updating interview status, and more. Get reports and analytics at your fingertips and plan better hiring strategies.",https://www.zoho.com/recruit/,HRMS,ts
Zoho Sheet,,,Data Management And Storage,ts
Zoom,"Zoom unifies cloud video conferencing, simple online meetings, and cross platform group chat into one easy-to-use platform. Our solution offers the best video, audio, and screen-sharing experience across Zoom Rooms, Windows, Mac, iOS, Android, and H.323/SIP room systems.",https://zoom.us/,Audio Conferencing,ts
Nuxt.js,"Nuxt.js presets all the configuration needed to make your development of a Vue.js application enjoyable.

You can use Nuxt.js for SSR, SPA, Static Generated, PWA and more.",https://orion.sh,Frontend Framework,ts
Vue.js,It is a library for building interactive web interfaces. It provides data-reactive components with a simple and flexible API. ,http://vuejs.org/,JavaScript MVC Framework,ts
Next.js,Next.js is a minimalistic framework for server-rendered React applications.,https://zeit.co,Application Frameworks,ts
linkerd,"linkerd is an out-of-process network stack for microservices. It functions as a transparent RPC proxy, handling everything needed to make inter-service RPC safe and sane--including load-balancing, service discovery, instrumentation, and routing.",https://linkerd.io/,Content Marketing Tools,ts
stdlib,"It is the fastest, easiest way to build infinitely scalable, self-healing APIs. Standard Library is based on Function as a Service (""serverless"") architecture, initially popularized by AWS Lambda. You can use Standard Library to build modular, scalable APIs for yourself and other developers in minutes without having to manage servers, gateways, domains, write documentation, or build SDKs. Your development workflow has never been easier - focus on writing code you love, let Standard Library handle everything else.",https://stdlib.com/,"Queueing, Messaging And Background Processing",ts
repo-peek,It is a command line tool to peek a remote repo hosted on github or gitlab locally and view it in your favorite editor. The tool handles cleanup of the repo once you exit your editor.,https://github.com/rahulunair/repo-peek,Landing Pages,ts
runrestic,"It is a simple Python wrapper script for the Restic backup software that initiates a backup, prunes any old backups according to a retention policy, and validates backups for consistency. The script supports specifying your settings in a declarative configuration file rather than having to put them all on the command-line, and handles common errors.",https://github.com/andreasnuesslein/runrestic,Enterprise Data Storage,ts
shmenu,"Simply direct the items to shmenu's stdin, separated by newlines.",https://github.com/Crestwave/shmenu,Build Automation,ts
navi,"It allows you to browse through cheatsheets (that you may write yourself or download from maintainers) and execute commands, prompting for argument values.",https://github.com/denisidoro/navi,Energy And Utilities Vertical Software,ts
k3sup,It is a light-weight utility to get from zero to KUBECONFIG with k3s on any local or remote VM. All you need is ssh access and the k3sup binary to get kubectl access immediately. k3sup app install then provides several tillerless-helm charts out of the box.,https://github.com/alexellis/k3sup,Containers And Microservices,ts
strans,s[tring] trans[form] is an intuitive string manipulation utility for the shell. Users do not need to know anything about programming. ,https://github.com/Inventitech/strans,Energy And Utilities Vertical Software,ts
drf-yasg,Generate real Swagger/OpenAPI 2.0 specifications from a Django Rest Framework API.,https://drf-yasg.readthedocs.io/en/stable/readme.html,Debugging Tools,ts
rga,"It is a line-oriented search tool that allows you to look for a regex in a multitude of file types. it wraps the awesome ripgrep and enables it to search in pdf, docx, sqlite, jpg, movie subtitles etc.",https://github.com/phiresky/ripgrep-all,Keyword Research Tools,ts
catj,"It makes it easier to understand the structure of JSON files. The output is valid JavaScript which can be used directly in code.
It's very helpful when writing queries for tools like jq.",https://github.com/soheilpro/catj,Document Collaboration,ts
netcup,"It is your partner for quality web hosting, server management, colocation and other Internet services for a successful, reliable and secure Internet presence. We put everything in motion so that you can make your website individually.",https://www.netcup.eu/,Static Site Publisher,ts
react-three-fiber,"It is a React renderer for Threejs on the web and react-native. Rendering performance is up to Threejs and the GPU. Components participate in the renderloop outside of React, without any additional overhead.",https://github.com/react-spring/react-three-fiber,Game Development,ts
pdoc,"It auto-generates API documentation that follows your project's Python module hierarchy. It requires no configuration, has first-class support for type annotations, cross-links between identifiers, comes with an integrated live-reloading web server, uses customizable HTML templates, understands numpydoc and Google-style docstrings, and is permissively licensed.",https://pdoc.dev/,Document Collaboration,ts
libpng,"It is the official Portable Network Graphics (PNG) reference library. It is a platform-independent library that contains C functions for handling PNG images. It supports almost all of PNG's features, is extensible, and has been widely used and tested.",http://www.libpng.org/pub/png/libpng.html,Image Processing API,ts
peewee,"A small, expressive orm, written in python (2.6+, 3.2+), with built-in support for sqlite, mysql and postgresql and special extensions like hstore.",https://github.com/coleifer/peewee,Libraries And Widgets,ts
instainer,InstaDocker is a Docker container hosting service which allows run any Docker container on the cloud instantly.,http://instainer.com/,Containers And Microservices,ts
pre-commit,pre-commit checks your code for errors before you commit it. pre-commit is configurable.,http://jish.github.io/pre-commit/,CSS Preprocessor,ts
hyperscript,"It is an experimental scripting language designed for the web, inspired by HyperTalk. Its core feature is the ability to embed event handlers directly on HTML elements.",https://hyperscript.org/,Languages,ts
3scale,"3scale's API Management platform provides services and solutions, allowing you to Operate, Manage and Distribute your APIs. Trusted by 450+ API programs.",http://www.3scale.net/,API Management,ts
3veta,"It is an all-in-one solution that empowers consultants, creators, and service providers to schedule or get booked, host video meetings in the browser, Get paid instantly, and much more!",https://3veta.com,Audio Conferencing,ts
scikit-image,scikit-image is a collection of algorithms for image processing.,http://scikit-image.org/,Libraries And Widgets,ts
sktime,"It is a Python machine learning toolbox for time series with a unified interface for multiple learning tasks. It provides dedicated time series algorithms and scikit-learn compatible tools for building, tuning, and evaluating composite models.",https://www.sktime.org/en/latest/,Data Science And Machine Learning,ts
lazygit,"It is a simple terminal UI for git commands, written in Go with the gocui library.",https://github.com/jesseduffield/lazygit,Development Tools,ts
ngrok,ngrok is a reverse proxy that creates a secure tunnel between from a public endpoint to a locally running web service. ngrok captures and analyzes all traffic over the tunnel for later inspection and replay.,https://ngrok.com/,CSS Preprocessor,ts
oso,Oso Cloud is authorization-as-a-service. It provides abstractions for building and iterating on authorization in your application – based on years of work with hundreds of engineering teams.,https://www.osohq.com/,Identity And Access Management,ts
dockersh,"dockersh is designed to be used as a login shell on machines with multiple interactive users. When a user invokes dockersh, it will bring up a Docker container (if not already running), and then spawn a new interactive shell in the container's namespace.",https://github.com/Yelp/dockersh,Containers And Microservices,ts
xmysql,one command to generate REST APIs for any MySql database,https://github.com/o1lab/xmysql,Database Tools,ts
900dpi,Create a CMS using the tools you already know. Make static websites editable by adding a CSS class. Manage it all from right inside your Dropbox folder.,http://900dpi.com/,Enterprise Content Management,ts
commercetools,"Our headless commerce platform separates frontend and backend functionality. So commercetools enables businesses to create seamless shopping experiences across all digital touchpoints. Our flexible API lets you engage with your customers via webshops, mobile apps, voice assistants, AR/VR applications, social networks, and others.",https://commercetools.com/,Ecommerce Platform,ts
launchpage-rails,"Prelaunch MVP landing page (open source alternative to LaunchRock) to get you going quickly so you can focus on your product. Written in Ruby and Rails 4.2 with email collection for two or more user types, social sharing after user signs in, and automailer to new user.",https://github.com/codelitt/launchpage-rails,Landing Pages,ts
dbdocs,"It is a free & simple database documentation for teams and businesses
Help your fellow developer and clients understand any database quickly with Data Dictionary & ERDs.",https://dbdocs.io/,Database Tools,ts
isomorphic-git,"It is a pure JavaScript reimplementation of git that works in both Node.js and browser JavaScript environments. It can read and write to git repositories, fetch from and push to git remotes (such as GitHub), all without any native C++ module dependencies.",https://isomorphic-git.org/,Configuration Management,ts
vsChat,This extension helps you Chat with developers around the world. You can use a nickname without login.,https://github.com/Ademking/vsChat,IDEs And Text Editors,ts
pganalyze,"The overview dashboard reveals which queries slow down your app, and during which times of the day your database performance suffers most. Log Insights and automated EXPLAIN plan insights give actionable advice on how to resolve issues.",https://pganalyze.com/,Database Tools,ts
dawson,"dawson is a serverless web framework for Node.js on AWS (CloudFormation, CloudFront, API Gateway, Lambda). You can use dawson to build and deploy backend code and infrastructure for single-page apps + API, pure APIs or server-rendered pages.",https://dawson.sh,"Queueing, Messaging And Background Processing",ts
k6,It is a developer centric open source load testing tool for testing the performance of your backend infrastructure. It’s built with Go and JavaScript to integrate well into your development workflow.,https://k6.io/,Performance And Load Testing,ts
react-beautiful-dnd,"There are a lot of libraries out there that allow for drag and drop interactions within React. Most notable of these is the amazing react-dnd. It does an incredible job at providing a great set of drag and drop primitives which work especially well with the wildly inconsistent html5 drag and drop feature. react-beautiful-dnd is a higher level abstraction specifically built for vertical and horizontal lists. Within that subset of functionality react-beautiful-dnd offers a powerful, natural and beautiful drag and drop experience. However, it does not provide the breadth of functionality offered by react-dnd.",http://www.atlassian.com/,CSS Preprocessor,ts
vue-jazzicon,"This component is made to be identical to the visual identifiers present in the metamask project, in order to create visual continuity between a dApp and the metamask plugin which may be used to sign ethereum transactions.",https://github.com/man15h/vue-jazzicon,JavaScript MVC Framework,ts
pgweb,"This is a web-based browser for PostgreSQL database server. Its written in Go and works on Mac OSX, Linux and Windows machines. Main idea behind using Go for the backend is to utilize language's ability for cross-compile source code for multiple platforms. This project is an attempt to create a very simple and portable application to work with PostgreSQL databases.",https://github.com/sosedoff/pgweb/,Database Tools,ts
stts,"With a click of the menubar icon, you can see the status of your favorite services. You can also be notified when a service goes down or gets restored. stts is designed to be unobtrusive, only giving you the information you need and allowing you to access the status page with a single click.",https://itunes.apple.com/us/app/stts/id1187772509?mt=12,Infrastructure Monitoring,ts
telbee,"Add voice messaging to your website/webapp, or create standalone recorders to share via social media, email and more. Receive voice messages to listen or read transcribed in a team inbox.",https://www.telbee.io/,Business Text Messaging,ts
ggez,"It is a lightweight game framework for making 2D games with minimum friction. It aims to implement an API based on (a Rustified version of) the LÖVE game framework. Thus it contains portable 2D drawing, sound, resource loading and event handling.",https://ggez.rs/,Game Development,ts
hdoc,"It is a modern documentation tool for C++ with the goal of helping developers create great documentation, painlessly. To accomplish this goal, it automatically generates API documentation, puts Markdown pages alongside your documentation, and lets you search through your documentation interactively. Above all, it is designed to produce great results with minimal configuration and hassle.",https://hdoc.io/,Document Collaboration,ts
kube-bench,"It is a Go application that checks whether Kubernetes is deployed securely by running the checks documented in the CIS Kubernetes Benchmark.

Tests are configured with YAML files, making this tool easy to update as test specifications evolve.",https://github.com/aquasecurity/kube-bench,Containers And Microservices,ts
go-zero,It is a web and RPC framework written in Go. It's born to ensure the stability of busy sites with resilient design. Builtin goctl greatly improves the development productivity.,https://go-zero.dev/en/,Content Marketing Tools,ts
hokolinks,HOKO offers publishers a new way to monetize their users by turning their app or site into an AI powered marketplace.,https://hokolinks.com/,Attribution Tracking,ts
ejabberd,"It is a distributed, fault-tolerant technology that allows the creation of large-scale instant messaging applications. The server can reliably support thousands of simultaneous users on a single node and has been designed to provide exceptional standards of fault tolerance. ",https://www.ejabberd.im/,"Queueing, Messaging And Background Processing",ts
git-split-diffs,"GitHub style split diffs with syntax highlighting in your terminal. By default, salient changes within lines are also highlighted. ",https://github.com/banga/git-split-diffs,Development Tools,ts
github-elements,A collection of GitHub's Web Component. 17 open source custom elements.,https://github.com/github/github-elements,Retargeting,ts
git-branchless,"It is a suite of tools to help you visualize, navigate, manipulate, and repair your commit history. It's based off of the branchless Mercurial workflows at large companies such as Google and Facebook.",https://github.com/arxanas/git-branchless,Development Tools,ts
aptly,"aptly is a swiss army knife for Debian repository management: it allows you to mirror remote repositories, manage local package repositories, take snapshots, pull new versions of packages along with dependencies, publish as Debian repository.",http://www.aptly.info/,Hosted Email,ts
etcd,"etcd is a distributed key value store that provides a reliable way to store data across a cluster of machines. It’s open-source and available on GitHub. etcd gracefully handles master elections during network partitions and will tolerate machine failure, including the master.",https://coreos.com/,Containers And Microservices,ts
imgix,"imgix is the leading visual media platform that businesses choose to improve user experience, website performance, and cost-saving. imgix offers robust image and video processing, global content delivery, and intelligent asset management.",https://imgix.com/,Image Processing API,ts
fancybox,"It is a tool that offers a nice and elegant way to add zooming functionality for images, html content and multi-media on your webpages. It is built on the top of the popular JavaScript framework jQuery and is both easy to implement and a snap to customize.",http://fancyapps.com/fancybox/3/,Libraries And Widgets,ts
delayed_job,Delayed_job (or DJ) encapsulates the common pattern of asynchronously executing longer tasks in the background. It is a direct extraction from Shopify where the job table is responsible for a multitude of core tasks. ,https://github.com/collectiveidea/delayed_job,Package Manager,ts
telegram-download-deamon,"A simple script to automate telegram download of big files. If you have got an Internet connected computer or NAS and you want to automate file downloading from Telegram channels, this daemon is for you.",https://github.com/alfem/telegram-download-daemon,FTP And File Uploads,ts
dbdiagram,Quick and simple free tool to help you draw your database relationship diagrams and flow quickly using simple DSL language.,https://dbdiagram.io/home,Database Tools,ts
plpgunit,It is a PostgreSQL unit testing framework. It started out of curiosity on why a unit testing framework cannot be simple and easy to use. It does not require any additional dependencies and is ready to be used on your PostgreSQL Server database.,https://github.com/mixerp/plpgunit,Database Tools,ts
ceph,"In computing,It is a free-software storage platform, implements object storage on a single distributed computer cluster, and provides interfaces for object-, block- and file-level storage.",http://ceph.com/,Languages,ts
